197|Arthropteridaceae|爬樹蕨科|藤蕨|Arthropteris palisotii|Arthropteris palisotii (Desv.) Alston|1|0||原生
563|Aspleniaceae|鐵角蕨科|革葉鐵角蕨|Asplenium adiantoides|Asplenium adiantoides (L.) C. Chr.|1|0||原生
564|Aspleniaceae|鐵角蕨科|深山鐵角蕨|Asplenium adiantum-nigrum|Asplenium adiantum-nigrum L.|1|0||原生
565|Aspleniaceae|鐵角蕨科|山蘇花|Asplenium antiquum|Asplenium antiquum Makino|1|0||原生
566|Aspleniaceae|鐵角蕨科|無配鐵角蕨|Asplenium apogamum|Asplenium apogamum N. Murak. & Hatan.|1|0||未知
567|Aspleniaceae|鐵角蕨科|南洋山蘇花|Asplenium australasicum|Asplenium australasicum (J. Sm.) Hook.|1|0||原生
568|Aspleniaceae|鐵角蕨科|大鐵角蕨|Asplenium bullatum|Asplenium bullatum Wall. ex Mett.|1|0|NT|原生
569|Aspleniaceae|鐵角蕨科|姬鐵角蕨|Asplenium capillipes|Asplenium capillipes Makino|1|0||原生
570|Aspleniaceae|鐵角蕨科|單邊鐵角蕨|Asplenium cataractarum|Asplenium cataractarum Rosenst.|1|0||原生
571|Aspleniaceae|鐵角蕨科|薄葉孔雀鐵角蕨|Asplenium cheilosorum|Asplenium cheilosorum Kunze ex Mett.|1|0||原生
572|Aspleniaceae|鐵角蕨科|大蓬萊鐵角蕨|Asplenium cuneatiforme|Asplenium cuneatiforme Christ|1|1||原生
573|Aspleniaceae|鐵角蕨科|劍葉鐵角蕨|Asplenium ensiforme|Asplenium ensiforme Wall. ex Hook. & Grev.|1|0||原生
574|Aspleniaceae|鐵角蕨科|剪葉鐵角蕨|Asplenium excisum|Asplenium excisum C. Presl|1|0||原生
575|Aspleniaceae|鐵角蕨科|複齒鐵角蕨|Asplenium filipes|Asplenium filipes Copel.|1|0||未知
576|Aspleniaceae|鐵角蕨科|南海鐵角蕨|Asplenium formosae|Asplenium formosae Christ|1|0||原生
577|Aspleniaceae|鐵角蕨科|叢葉鐵角蕨|Asplenium griffithianum|Asplenium griffithianum Hook.|1|0||原生
578|Aspleniaceae|鐵角蕨科|縮羽鐵角蕨|Asplenium incisum|Asplenium incisum Thunb.|1|0||原生
579|Aspleniaceae|鐵角蕨科|鱗柄鐵角蕨|Asplenium laciniatum|Asplenium laciniatum D. Don|1|0||原生
580|Aspleniaceae|鐵角蕨科|裂葉鐵角蕨|Asplenium lobulatum|Asplenium lobulatum Mett.|1|0||原生
581|Aspleniaceae|鐵角蕨科|大黑柄鐵角蕨|Asplenium neolaserpitiifolium|Asplenium neolaserpitiifolium Tardieu & Ching|1|0||原生
582|Aspleniaceae|鐵角蕨科|臺灣山蘇花|Asplenium nidus|Asplenium nidus L.|1|0||原生
583|Aspleniaceae|鐵角蕨科|生芽鐵角蕨|Asplenium normale|Asplenium normale D. Don|1|0||原生
584|Aspleniaceae|鐵角蕨科|綠柄剪葉鐵角蕨|Asplenium obscurum|Asplenium obscurum Blume|1|0|NT|原生
585|Aspleniaceae|鐵角蕨科|俄氏鐵角蕨|Asplenium oldhami|Asplenium oldhami Hance|1|0||原生
586|Aspleniaceae|鐵角蕨科|北京鐵角蕨|Asplenium pekinense|Asplenium pekinense Hance|1|0|DD|未知
6559|Aspleniaceae|鐵角蕨科|碧鳳鐵角蕨|Asplenium pifongiae|Asplenium pifongiae L.-Y. Kuo, F.W. Li & Y.H. Chang|1|1||原生
587|Aspleniaceae|鐵角蕨科|斜葉鐵角蕨|Asplenium planicaule|Asplenium planicaule Wall. ex E.J. Lowe|1|0||原生
588|Aspleniaceae|鐵角蕨科|長生鐵角蕨|Asplenium prolongatum|Asplenium prolongatum Hook.|1|0||原生
589|Aspleniaceae|鐵角蕨科|黑鱗鐵角蕨|Asplenium pseudolaserpitiifolium|Asplenium pseudolaserpitiifolium Ching|1|0|DD|未知
590|Aspleniaceae|鐵角蕨科|細葉鐵角蕨|Asplenium pulcherrimum|Asplenium pulcherrimum (Baker) Ching ex Tardieu|1|0|NT|原生
591|Aspleniaceae|鐵角蕨科|尖葉鐵角蕨|Asplenium ritoense|Asplenium ritoense Hayata|1|0||原生
592|Aspleniaceae|鐵角蕨科|銀杏葉鐵角蕨|Asplenium ruta-muraria|Asplenium ruta-muraria L.|1|0|VU|原生
593|Aspleniaceae|鐵角蕨科|對開蕨|Asplenium scolopendrium|Asplenium scolopendrium L.|1|0|VU|原生
594|Aspleniaceae|鐵角蕨科|線葉鐵角蕨|Asplenium septentrionale|Asplenium septentrionale (L.) Hoffm.|1|0|NT|原生
595|Aspleniaceae|鐵角蕨科|蘭嶼鐵角蕨|Asplenium serricula|Asplenium serricula Fée|1|0|NT|原生
596|Aspleniaceae|鐵角蕨科|四國鐵角蕨|Asplenium shikokianum|Asplenium shikokianum Makino|1|0||原生
597|Aspleniaceae|鐵角蕨科|小鐵角蕨|Asplenium subnormale|Asplenium subnormale Copel.|1|0|DD|原生
598|Aspleniaceae|鐵角蕨科|鈍齒鐵角蕨|Asplenium tenerum|Asplenium tenerum G. Forst.|1|0|NT|原生
599|Aspleniaceae|鐵角蕨科|小葉鐵角蕨|Asplenium tenuicaule|Asplenium tenuicaule Hayata|1|0||原生
600|Aspleniaceae|鐵角蕨科|薄葉鐵角蕨|Asplenium tenuifolium|Asplenium tenuifolium D. Don|1|0||原生
601|Aspleniaceae|鐵角蕨科|鐵角蕨|Asplenium trichomanes|Asplenium trichomanes L.|1|0||原生
602|Aspleniaceae|鐵角蕨科|三翅鐵角蕨|Asplenium tripteropus|Asplenium tripteropus Nakai|1|0||原生
604|Aspleniaceae|鐵角蕨科|綠柄鐵角蕨|Asplenium viride|Asplenium viride Huds.|1|0||原生
605|Aspleniaceae|鐵角蕨科|威氏鐵角蕨|Asplenium wilfordii|Asplenium wilfordii Mett. ex Kuhn|1|0||原生
606|Aspleniaceae|鐵角蕨科|萊氏鐵角蕨|Asplenium wrightii|Asplenium wrightii D.C. Eaton ex Hook.|1|0||原生
607|Aspleniaceae|鐵角蕨科|雲南鐵角蕨|Asplenium yunnanense|Asplenium yunnanense Franch.|1|0|DD|原生
562|Aspleniaceae|鐵角蕨科|王氏鐵角蕨|Asplenium ×wangii|Asplenium ×wangii C.M. Kuo|1|0||原生
5593|Athyriaceae|蹄蓋蕨科|沼生蹄蓋蕨|Athyrium palustre|Athyrium palustre Seriz.|1|0|EN|原生
519|Athyriaceae|蹄蓋蕨科|貞蕨|Cornopteris decurrenti-alata|Cornopteris decurrenti-alata (Hook.) Nakai|1|0||原生
520|Athyriaceae|蹄蓋蕨科|大葉貞蕨|Cornopteris fluvialis|Cornopteris fluvialis (Hayata) Tagawa|1|0||原生
521|Athyriaceae|蹄蓋蕨科|黑葉貞蕨|Cornopteris opaca|Cornopteris opaca (D. Don) Tagawa|1|0||未知
522|Athyriaceae|蹄蓋蕨科|菲律賓貞蕨|Cornopteris philippinensis|Cornopteris philippinensis M. Kato|1|0|DD|未知
527|Athyriaceae|蹄蓋蕨科|亞蹄蓋蕨|Deparia allantodioides|Deparia allantodioides (Bedd.) M. Kato|1|0||未知
5240|Athyriaceae|蹄蓋蕨科|假腸蕨|Deparia formosana|Deparia formosana (Rosenst.) R. Sano|1|0||原生
5216|Athyriaceae|蹄蓋蕨科|昆明假蹄蓋蕨|Deparia longipes|Deparia longipes (Ching) Shinohara|1|0|DD|未知
528|Athyriaceae|蹄蓋蕨科|假蹄蓋蕨|Deparia petersenii|Deparia petersenii (Kunze) M. Kato|1|0||未知
5217|Athyriaceae|蹄蓋蕨科|羽裂雙蓋蕨|Deparia tomitaroana|Deparia tomitaroana (Masam.) R. Sano|1|0|DD|原生
530|Athyriaceae|蹄蓋蕨科|阿玉雙蓋蕨|Diplazium agyokuense|Diplazium agyokuense Tagawa|1|0|DD|未知
531|Athyriaceae|蹄蓋蕨科|奄美雙蓋蕨|Diplazium amamianum|Diplazium amamianum Tagawa|1|0||原生
532|Athyriaceae|蹄蓋蕨科|粗柄雙蓋蕨|Diplazium asperum|Diplazium asperum Blume|1|0|DD|原生
533|Athyriaceae|蹄蓋蕨科|華雙蓋蕨|Diplazium chinense|Diplazium chinense (Baker) C. Chr.|1|0|EN|原生
534|Athyriaceae|蹄蓋蕨科|邊生雙蓋蕨|Diplazium conterminum|Diplazium conterminum Christ|1|0||原生
535|Athyriaceae|蹄蓋蕨科|厚葉雙蓋蕨|Diplazium crassiusculum|Diplazium crassiusculum Ching|1|0|VU|未知
536|Athyriaceae|蹄蓋蕨科|廣葉鋸齒雙蓋蕨|Diplazium dilatatum|Diplazium dilatatum Blume|1|0||原生
537|Athyriaceae|蹄蓋蕨科|德氏雙蓋蕨|Diplazium doederleinii|Diplazium doederleinii (Luerss.) Makino|1|0||原生
538|Athyriaceae|蹄蓋蕨科|細柄雙蓋蕨|Diplazium donianum|Diplazium donianum (Mett.) Tardieu|1|0||原生
539|Athyriaceae|蹄蓋蕨科|過溝菜蕨|Diplazium esculentum|Diplazium esculentum (Retz.) Sw.|1|0||原生
5611|Athyriaceae|蹄蓋蕨科|毛軸過溝菜蕨|Diplazium esculentum var. pubescens|Diplazium esculentum var. pubescens (Link) Tardieu & C. Chr.|1|0||原生
540|Athyriaceae|蹄蓋蕨科|網脈雙蓋蕨|Diplazium formosanum|Diplazium formosanum Rosenst.|1|0||原生
541|Athyriaceae|蹄蓋蕨科|翅柄雙蓋蕨|Diplazium incomptum|Diplazium incomptum Tagawa|1|0|EN|原生
542|Athyriaceae|蹄蓋蕨科|角板山雙蓋蕨|Diplazium kappanense|Diplazium kappanensis Hayata|1|0|DD|未知
543|Athyriaceae|蹄蓋蕨科|川上氏雙蓋蕨|Diplazium kawakamii|Diplazium kawakamii Hayata|1|0||原生
544|Athyriaceae|蹄蓋蕨科|疏葉雙蓋蕨|Diplazium laxifrons|Diplazium laxifrons Rosenst.|1|0|DD|未知
545|Athyriaceae|蹄蓋蕨科|裂葉雙蓋蕨|Diplazium lobatum|Diplazium lobatum (Tagawa) Tagawa|1|0|NT|原生
546|Athyriaceae|蹄蓋蕨科|大葉雙蓋蕨|Diplazium megaphyllum|Diplazium megaphyllum (Baker) Christ|1|0|VU|原生
547|Athyriaceae|蹄蓋蕨科|深山雙蓋蕨|Diplazium mettenianum|Diplazium mettenianum (Miq.) C. Chr.|1|0||原生
548|Athyriaceae|蹄蓋蕨科|琉球雙蓋蕨|Diplazium okinawaense|Diplazium okinawaense Tagawa|1|0||原生
549|Athyriaceae|蹄蓋蕨科|假耳羽雙蓋蕨|Diplazium okudairai|Diplazium okudairai Makino|1|0|DD|未知
550|Athyriaceae|蹄蓋蕨科|廣葉深山雙蓋蕨|Diplazium petrii|Diplazium petrii Tardieu|1|0||原生
551|Athyriaceae|蹄蓋蕨科|擬德氏雙蓋蕨|Diplazium pseudodoederleinii|Diplazium pseudodoederleinii Hayata|1|0||原生
552|Athyriaceae|蹄蓋蕨科|樸氏雙蓋蕨|Diplazium pullingeri|Diplazium pullingeri (Baker) J. Sm.|1|0||原生
553|Athyriaceae|蹄蓋蕨科|長苞雙蓋蕨|Diplazium squamigerum|Diplazium squamigerum (Mett.) C. Hope|1|0||原生
554|Athyriaceae|蹄蓋蕨科|單葉雙蓋蕨|Diplazium subsinuatum|Diplazium subsinuatum (Wall. ex Hook. & Grev.) Tagawa|1|0||原生
555|Athyriaceae|蹄蓋蕨科|臺灣雙蓋蕨|Diplazium taiwanense|Diplazium taiwanense Tagawa|1|0||原生
556|Athyriaceae|蹄蓋蕨科|刺柄雙蓋蕨|Diplazium virescens|Diplazium virescens Kunze|1|0||原生
557|Athyriaceae|蹄蓋蕨科|鋸齒雙蓋蕨|Diplazium wichurae|Diplazium wichurae (Mett.) Diels|1|0||原生
286|Blechnaceae|烏毛蕨科|雉尾烏毛蕨|Blechnum melanopus|Blechnum melanopus Hook.|1|0||原生
287|Blechnaceae|烏毛蕨科|烏毛蕨|Blechnum orientale|Blechnum orientale L.|1|0||原生
288|Blechnaceae|烏毛蕨科|蘇鐵蕨|Brainea insignis|Brainea insignis (Hook.) J. Sm.|1|0|VU|原生
289|Blechnaceae|烏毛蕨科|假桫欏|Diploblechnum fraseri|Diploblechnum fraseri (A. Cunn.) De Vol|1|0|CR|原生
290|Blechnaceae|烏毛蕨科|天長羅曼蕨|Struthiopteris eburnea var. obtusa|Struthiopteris eburnea var. obtusa (Tagawa) Tagawa|1|0|VU|原生
291|Blechnaceae|烏毛蕨科|韓氏羅曼蕨|Struthiopteris hancockii|Struthiopteris hancockii (Hance) Tagawa|1|0||原生
292|Blechnaceae|烏毛蕨科|哈氏狗脊蕨|Woodwardia harlandii|Woodwardia harlandii Hook.|1|0|NT|原生
293|Blechnaceae|烏毛蕨科|日本狗脊蕨|Woodwardia japonica|Woodwardia japonica (L. f.) Sm.|1|0||原生
294|Blechnaceae|烏毛蕨科|細葉狗脊蕨|Woodwardia kempii|Woodwardia kempii Copel.|1|0|VU|原生
295|Blechnaceae|烏毛蕨科|臺灣狗脊蕨|Woodwardia orientalis var. formosana|Woodwardia orientalis var. formosana Rosenst.|1|0||原生
296|Blechnaceae|烏毛蕨科|生芽狗脊蕨|Woodwardia unigemmata|Woodwardia unigemmata (Makino) Nakai|1|0||原生
126|Cibotiaceae|金狗毛蕨科|金狗毛蕨|Cibotium barometz|Cibotium barometz (L.) J. Sm.|1|0||原生
127|Cibotiaceae|金狗毛蕨科|臺灣金狗毛蕨|Cibotium taiwanense|Cibotium taiwanense C.M. Kuo|1|1||原生
128|Cyatheaceae|桫欏科|蘭嶼筆筒樹|Cyathea fenicis|Cyathea fenicis Copel.|1|0|VU|原生
129|Cyatheaceae|桫欏科|韓氏桫欏|Cyathea hancockii|Cyathea hancockii Copel.|1|0|NT|原生
130|Cyatheaceae|桫欏科|筆筒樹|Cyathea lepifera|Cyathea lepifera (J. Sm. ex Hook.) Copel.|1|0||原生
131|Cyatheaceae|桫欏科|南洋桫欏|Cyathea loheri|Cyathea loheri Christ|1|0|NT|原生
132|Cyatheaceae|桫欏科|臺灣樹蕨|Cyathea metteniana|Cyathea metteniana (Hance) C. Chr. & Tardieu|1|0||原生
133|Cyatheaceae|桫欏科|鬼桫欏|Cyathea podophylla|Cyathea podophylla (Hook.) Copel.|1|0||原生
134|Cyatheaceae|桫欏科|臺灣桫欏|Cyathea spinulosa|Cyathea spinulosa Wall. ex Hook.|1|0||原生
523|Cystopteridaceae|冷蕨科|冷蕨|Cystopteris fragilis|Cystopteris fragilis (L.) Bernh.|1|0||原生
524|Cystopteridaceae|冷蕨科|毛冷蕨|Cystopteris japonica|Cystopteris japonica Luerss.|1|0||原生
525|Cystopteridaceae|冷蕨科|寬葉冷蕨|Cystopteris moupinensis|Cystopteris moupinensis Franch.|1|0||原生
526|Cystopteridaceae|冷蕨科|粗柄毛冷蕨|Cystopteris tenuisecta|Cystopteris tenuisecta (Blume) Mett.|1|0||原生
558|Cystopteridaceae|冷蕨科|羽節蕨|Gymnocarpium oyamense|Gymnocarpium oyamense (Baker) Ching|1|0|CR|原生
559|Cystopteridaceae|冷蕨科|細裂羽節蕨|Gymnocarpium remotepinnatum|Gymnocarpium remotepinnatum (Hayata) Ching|1|0||未知
185|Davalliaceae|骨碎補科|臺灣小膜蓋蕨|Araiostegia parvipinnula|Araiostegia parvipinnula (Hayata) Copel.|1|0||原生
186|Davalliaceae|骨碎補科|大葉骨碎補|Davallia formosana|Davallia formosana Hayata|1|0||原生
187|Davalliaceae|骨碎補科|海州骨碎補|Davallia mariesii|Davallia mariesii T. Moore ex Baker|1|0||原生
188|Davalliaceae|骨碎補科|闊葉骨碎補|Davallia solida|Davallia solida (G. Forst.) Sw.|1|0||原生
189|Davalliaceae|骨碎補科|圓蓋陰石蕨|Davallia tyermannii|Davallia tyermannii (T. Moore) Baker|1|0||未知
190|Davalliaceae|骨碎補科|阿里山陰石蕨|Humata chrysanthemifolia|Humata chrysanthemifolia (Hayata) C. Chr.|1|0|NT|原生
191|Davalliaceae|骨碎補科|杯狀蓋陰石蕨|Humata griffithiana|Humata griffithiana (Hook.) C. Chr.|1|0||原生
192|Davalliaceae|骨碎補科|馬來陰石蕨|Humata pectinata|Humata pectinata (Sm.) Desv.|1|0|EN|原生
193|Davalliaceae|骨碎補科|陰石蕨|Humata repens|Humata repens (L. f.) Small ex Diels|1|0|NT|原生
194|Davalliaceae|骨碎補科|鱗葉陰石蕨|Humata trifoliata|Humata trifoliata Cav.|1|0||原生
195|Davalliaceae|骨碎補科|熱帶陰石蕨|Humata vestita|Humata vestita (Blume) T. Moore|1|0|DD|原生
198|Davalliaceae|骨碎補科|腎蕨|Nephrolepis auriculata|Nephrolepis auriculata (L.) Trimen|1|0||原生
199|Davalliaceae|骨碎補科|長葉腎蕨|Nephrolepis biserrata|Nephrolepis biserrata (Sw.) Schott|1|0||原生
200|Davalliaceae|骨碎補科|毛葉腎蕨|Nephrolepis multiflora|Nephrolepis multiflora (Roxb.) F.M. Jarrett ex C.V. Morton|1|0||原生
135|Dennstaedtiaceae|碗蕨科|細毛碗蕨|Dennstaedtia hirsuta|Dennstaedtia hirsuta (Sw.) Mett. ex Miq.|1|0||原生
136|Dennstaedtiaceae|碗蕨科|碗蕨|Dennstaedtia scabra|Dennstaedtia scabra (Wall. ex Hook.) T. Moore|1|0||原生
137|Dennstaedtiaceae|碗蕨科|刺柄碗蕨|Dennstaedtia scandens|Dennstaedtia scandens (Blume) T. Moore|1|0||原生
138|Dennstaedtiaceae|碗蕨科|司氏碗蕨|Dennstaedtia smithii|Dennstaedtia smithii (Hook.) T. Moore|1|0||原生
139|Dennstaedtiaceae|碗蕨科|栗蕨|Histiopteris incisa|Histiopteris incisa (Thunb.) J. Sm.|1|0||原生
140|Dennstaedtiaceae|碗蕨科|姬蕨|Hypolepis punctata|Hypolepis punctata (Thunb.) Mett. ex Kuhn|1|0||原生
141|Dennstaedtiaceae|碗蕨科|細葉姬蕨|Hypolepis tenuifolia|Hypolepis tenuifolia (G. Forst.) Bernh.|1|0||原生
142|Dennstaedtiaceae|碗蕨科|光葉鱗蓋蕨|Microlepia calvescens|Microlepia calvescens (Wall. ex Hook.) C. Presl|1|0||原生
143|Dennstaedtiaceae|碗蕨科|羽葉鱗蓋蕨|Microlepia calvescens var. intramarginalis|Microlepia calvescens var. intramarginalis (Tagawa) W.C. Shieh|1|0||原生
144|Dennstaedtiaceae|碗蕨科|虎克氏鱗蓋蕨|Microlepia hookeriana|Microlepia hookeriana (Wall. ex Hook.) C. Presl|1|0||原生
145|Dennstaedtiaceae|碗蕨科|克氏鱗蓋蕨|Microlepia krameri|Microlepia krameri C.M. Kuo|1|0||原生
146|Dennstaedtiaceae|碗蕨科|邊緣鱗蓋蕨|Microlepia marginata|Microlepia marginata (Panz.) C. Chr.|1|0||原生
147|Dennstaedtiaceae|碗蕨科|臺北鱗蓋蕨|Microlepia marginata var. bipinnata|Microlepia marginata var. bipinnata Makino|1|0||原生
148|Dennstaedtiaceae|碗蕨科|團羽鱗蓋蕨|Microlepia obtusiloba|Microlepia obtusiloba Hayata|1|0||原生
149|Dennstaedtiaceae|碗蕨科|闊葉鱗蓋蕨|Microlepia platyphylla|Microlepia platyphylla (D. Don) J. Sm.|1|0|DD|原生
150|Dennstaedtiaceae|碗蕨科|斜方鱗蓋蕨|Microlepia rhomboidea|Microlepia rhomboidea (Wall. ex Kunze) Prantl|1|0||未知
151|Dennstaedtiaceae|碗蕨科|中華鱗蓋蕨|Microlepia sinostrigosa|Microlepia sinostrigosa Ching|1|0|DD|原生
152|Dennstaedtiaceae|碗蕨科|熱帶鱗蓋蕨|Microlepia speluncae|Microlepia speluncae (L.) T. Moore|1|0||原生
153|Dennstaedtiaceae|碗蕨科|粗毛鱗蓋蕨|Microlepia strigosa|Microlepia strigosa (Thunb.) C. Presl|1|0||原生
154|Dennstaedtiaceae|碗蕨科|亞粗毛鱗蓋蕨|Microlepia substrigosa|Microlepia substrigosa Tagawa|1|0||原生
155|Dennstaedtiaceae|碗蕨科|臺灣鱗蓋蕨|Microlepia taiwaniana|Microlepia taiwaniana Tagawa|1|1|DD|原生
156|Dennstaedtiaceae|碗蕨科|嫩鱗蓋蕨|Microlepia tenera|Microlepia tenera Christ|1|0||原生
157|Dennstaedtiaceae|碗蕨科|針毛鱗蓋蕨|Microlepia trapeziformis|Microlepia trapeziformis (Roxb.) Kuhn|1|0||原生
158|Dennstaedtiaceae|碗蕨科|毛果鱗蓋蕨|Microlepia trichocarpa|Microlepia trichocarpa Hayata|1|1|NT|原生
159|Dennstaedtiaceae|碗蕨科|稀子蕨|Monachosorum henryi|Monachosorum henryi Christ|1|0||原生
160|Dennstaedtiaceae|碗蕨科|岩穴蕨|Monachosorum maximowiczii|Monachosorum maximowiczii (Baker) Hayata|1|0||原生
161|Dennstaedtiaceae|碗蕨科|曲軸蕨|Paesia radula|Paesia radula C. Chr.|1|0|CR|未知
162|Dennstaedtiaceae|碗蕨科|臺灣曲軸蕨|Paesia taiwanensis|Paesia taiwanensis W.C. Shieh|1|0||原生
163|Dennstaedtiaceae|碗蕨科|蕨|Pteridium aquilinum subsp. latiusculum|Pteridium aquilinum subsp. latiusculum (Desv.) Hultén|1|0||原生
164|Dennstaedtiaceae|碗蕨科|巒大蕨|Pteridium aquilinum subsp. wightianum|Pteridium aquilinum subsp. wightianum (J. Agardh) W.C. Shieh|1|0||原生
609|Dipteridaceae|雙扇蕨科|燕尾蕨|Cheiropleuria bicuspis|Cheiropleuria bicuspis (Blume) C. Presl|1|0||原生
608|Dipteridaceae|雙扇蕨科|雙扇蕨|Dipteris conjugata|Dipteris conjugata Reinw.|1|0||原生
326|Dryopteridaceae|鱗毛蕨科|大孢魚鱗蕨|Acrophorus macrocarpus|Acrophorus macrocarpus Ching & S.H. Wu|1|0||未知
327|Dryopteridaceae|鱗毛蕨科|魚鱗蕨|Acrophorus stipellatus|Acrophorus stipellatus T. Moore|1|0||原生
328|Dryopteridaceae|鱗毛蕨科|彎柄假複葉耳蕨|Acrorumohra diffracta|Acrorumohra diffracta (Baker) H. Itô|1|0||原生
329|Dryopteridaceae|鱗毛蕨科|哈氏假複葉耳蕨|Acrorumohra hasseltii|Acrorumohra hasseltii (Blume) Ching|1|0||原生
330|Dryopteridaceae|鱗毛蕨科|微彎假複葉耳蕨|Acrorumohra subreflexipinna|Acrorumohra subreflexipinna (Ogata) H. Itô|1|0||原生
331|Dryopteridaceae|鱗毛蕨科|玉山假複葉耳蕨|Acrorumohra yoroii|Acrorumohra yoroii (Seriz.) W.C. Shieh|1|0||原生
332|Dryopteridaceae|鱗毛蕨科|細葉複葉耳蕨|Arachniodes aristata|Arachniodes aristata (G. Forst.) Tindale|1|0||原生
5609|Dryopteridaceae|鱗毛蕨科|中華複葉耳蕨|Arachniodes chinensis|Arachniodes chinensis (Rosenst.) Ching|1|0||原生
333|Dryopteridaceae|鱗毛蕨科|臺灣兩面複葉耳蕨|Arachniodes festina|Arachniodes festina (Hance) Ching|1|0||原生
334|Dryopteridaceae|鱗毛蕨科|臺灣複葉耳蕨|Arachniodes globisora|Arachniodes globisora (Hayata) Ching|1|0|NT|原生
335|Dryopteridaceae|鱗毛蕨科|黑鱗複葉耳蕨|Arachniodes nigrospinosa|Arachniodes nigrospinosa (Ching) Ching|1|0|NT|原生
336|Dryopteridaceae|鱗毛蕨科|小葉複葉耳蕨|Arachniodes pseudoaristata|Arachniodes pseudoaristata (Tagawa) Ohwi|1|0||原生
337|Dryopteridaceae|鱗毛蕨科|斜方複葉耳蕨|Arachniodes rhomboidea|Arachniodes rhomboidea (Schott) Ching|1|0||原生
338|Dryopteridaceae|鱗毛蕨科|屋久複葉耳蕨|Arachniodes rhomboidea var. yakusimensis|Arachniodes rhomboidea var. yakusimensis (H. Itô) W.C. Shieh|1|0||原生
411|Dryopteridaceae|鱗毛蕨科|細葉實蕨|Bolbitis angustipinna|Bolbitis angustipinna (Hayata) H. Itô|1|0||原生
412|Dryopteridaceae|鱗毛蕨科|尾葉實蕨|Bolbitis heteroclita|Bolbitis heteroclita (C. Presl) Ching|1|0||原生
413|Dryopteridaceae|鱗毛蕨科|紅柄實蕨|Bolbitis scalpturata|Bolbitis scalpturata (Fée) Ching|1|0|VU|原生
414|Dryopteridaceae|鱗毛蕨科|海南實蕨|Bolbitis subcordata|Bolbitis subcordata (Copel.) Ching|1|0||原生
409|Dryopteridaceae|鱗毛蕨科|網脈刺蕨|Bolbitis ×laxireticulata|Bolbitis ×laxireticulata K. Iwats.|1|0||原生
410|Dryopteridaceae|鱗毛蕨科|南仁刺蕨|Bolbitis ×nanjenensis|Bolbitis ×nanjenensis C.M. Kuo|1|0||原生
297|Dryopteridaceae|鱗毛蕨科|頂囊肋毛蕨|Ctenitis apiciflora|Ctenitis apiciflora (Wall. ex Mett.) Ching|1|0||原生
298|Dryopteridaceae|鱗毛蕨科|愛德氏肋毛蕨|Ctenitis eatonii|Ctenitis eatonii (Baker) Ching|1|0||原生
299|Dryopteridaceae|鱗毛蕨科|川上氏肋毛蕨|Ctenitis kawakamii|Ctenitis kawakamii (Hayata) Ching|1|0||原生
300|Dryopteridaceae|鱗毛蕨科|白鱗肋毛蕨|Ctenitis maximowicziana|Ctenitis maximowicziana (Miq.) Ching|1|0|VU|原生
301|Dryopteridaceae|鱗毛蕨科|肋毛蕨|Ctenitis subglandulosa|Ctenitis subglandulosa (Hance) Ching|1|0||原生
302|Dryopteridaceae|鱗毛蕨科|玉山肋毛蕨|Ctenitis transmorrisonensis|Ctenitis transmorrisonensis (Hayata) Tagawa|1|0||原生
339|Dryopteridaceae|鱗毛蕨科|柳葉蕨|Cyrtogonellum fraxinellum|Cyrtogonellum fraxinellum (Christ) Ching|1|0|VU|原生
340|Dryopteridaceae|鱗毛蕨科|細齒貫眾蕨|Cyrtomium caryotideum|Cyrtomium caryotideum (Wall. ex Hook. & Grev.) C. Presl|1|0||原生
341|Dryopteridaceae|鱗毛蕨科|全緣貫眾蕨|Cyrtomium falcatum|Cyrtomium falcatum (L. f.) C. Presl|1|0||原生
342|Dryopteridaceae|鱗毛蕨科|狹葉貫眾蕨|Cyrtomium hookerianum|Cyrtomium hookerianum (C. Presl) C. Chr.|1|0||原生
343|Dryopteridaceae|鱗毛蕨科|尖葉貫眾蕨|Cyrtomium macrophyllum var. acuminatum|Cyrtomium macrophyllum var. acuminatum (Diels) Tagawa|1|0|EN|原生
344|Dryopteridaceae|鱗毛蕨科|臺灣貫眾蕨|Cyrtomium taiwanianum|Cyrtomium taiwanianum Tagawa|1|0|VU|原生
345|Dryopteridaceae|鱗毛蕨科|紅線蕨|Diacalpe aspidioides|Diacalpe aspidioides Blume|1|0|VU|原生
346|Dryopteridaceae|鱗毛蕨科|擬鱗毛蕨|Dryopsis ×fauriei|Dryopsis ×fauriei Holttum & P.J. Edwards|1|0||未知
347|Dryopteridaceae|鱗毛蕨科|腺鱗毛蕨|Dryopteris alpestris|Dryopteris alpestris Tagawa|1|0||原生
348|Dryopteridaceae|鱗毛蕨科|桫欏鱗毛蕨|Dryopteris atrata|Dryopteris atrata (Wall. ex Kunze) Ching|1|0||原生
349|Dryopteridaceae|鱗毛蕨科|闊葉鱗毛蕨|Dryopteris austriaca|Dryopteris austriaca (Jacq.) Woyn. ex Schinz & Thell.|1|0||原生
350|Dryopteridaceae|鱗毛蕨科|密毛鱗毛蕨|Dryopteris barbigera|Dryopteris barbigera (T. Moore ex Hook.) Kuntze|1|0||原生
351|Dryopteridaceae|鱗毛蕨科|闊鱗鱗毛蕨|Dryopteris championii|Dryopteris championii (Benth.) C. Chr. ex Ching|1|0|VU|未知
352|Dryopteridaceae|鱗毛蕨科|擬岩蕨|Dryopteris chrysocoma|Dryopteris chrysocoma (Christ) C. Chr.|1|0||原生
353|Dryopteridaceae|鱗毛蕨科|能高鱗毛蕨|Dryopteris costalisora|Dryopteris costalisora Tagawa|1|0||原生
354|Dryopteridaceae|鱗毛蕨科|迷人鱗毛蕨|Dryopteris decipiens|Dryopteris decipiens (Hook.) Kuntze|1|0|VU|未知
5218|Dryopteridaceae|鱗毛蕨科|遠軸鱗毛蕨|Dryopteris dickinsii|Dryopteris dickinsii (Franch. & Sav.) C. Chr.|1|1|DD|原生
355|Dryopteridaceae|鱗毛蕨科|頂羽鱗毛蕨|Dryopteris enneaphylla|Dryopteris enneaphylla (Baker) C. Chr.|1|0||原生
356|Dryopteridaceae|鱗毛蕨科|大頂羽鱗毛蕨|Dryopteris enneaphylla var. pseudosieboldii|Dryopteris enneaphylla var. pseudosieboldii (Hayata) Tagawa & K. Iwats.|1|1|NT|原生
357|Dryopteridaceae|鱗毛蕨科|密鱗鱗毛蕨|Dryopteris fibrillosa|Dryopteris fibrillosa (Baker) Christ|1|0||原生
358|Dryopteridaceae|鱗毛蕨科|臺灣鱗毛蕨|Dryopteris formosana|Dryopteris formosana (Christ) C. Chr.|1|0||原生
359|Dryopteridaceae|鱗毛蕨科|小苞鱗毛蕨|Dryopteris hendersonii|Dryopteris hendersonii (Bedd.) C. Chr.|1|0||原生
5219|Dryopteridaceae|鱗毛蕨科|黃山鱗毛蕨|Dryopteris huangshanensis|Dryopteris huangshanensis Ching|1|0|DD|原生
360|Dryopteridaceae|鱗毛蕨科|深山鱗毛蕨|Dryopteris hypophlebia|Dryopteris hypophlebia Hayata|1|0||原生
5220|Dryopteridaceae|鱗毛蕨科|近多鱗鱗毛蕨|Dryopteris komarovii|Dryopteris komarovii Kossinsky|1|0|DD|原生
361|Dryopteridaceae|鱗毛蕨科|疏葉鱗毛蕨|Dryopteris labordei|Dryopteris labordei (Christ) C. Chr.|1|0||原生
362|Dryopteridaceae|鱗毛蕨科|二型鱗毛蕨|Dryopteris lacera|Dryopteris lacera (Thunb.) Kuntze|1|0|VU|原生
5221|Dryopteridaceae|鱗毛蕨科|闊基鱗毛蕨|Dryopteris latibasis|Dryopteris latibasis Ching|1|0|DD|原生
363|Dryopteridaceae|鱗毛蕨科|厚葉鱗毛蕨|Dryopteris lepidopoda|Dryopteris lepidopoda Hayata|1|0||原生
364|Dryopteridaceae|鱗毛蕨科|三角葉鱗毛蕨|Dryopteris marginata|Dryopteris marginata (C.B. Clarke) Christ|1|0||原生
5111|Dryopteridaceae|鱗毛蕨科|黑孢鱗毛蕨|Dryopteris melanocarpa|Dryopteris melanocarpa Hayata|1|0||原生
365|Dryopteridaceae|鱗毛蕨科|臺東鱗毛蕨|Dryopteris polita|Dryopteris polita Rosenst.|1|0||原生
366|Dryopteridaceae|鱗毛蕨科|逆鱗鱗毛蕨|Dryopteris reflexosquamata|Dryopteris reflexosquamata Hayata|1|0||原生
367|Dryopteridaceae|鱗毛蕨科|史氏鱗毛蕨|Dryopteris scottii|Dryopteris scottii (Bedd.) Ching|1|0||原生
368|Dryopteridaceae|鱗毛蕨科|鋸齒葉鱗毛蕨|Dryopteris serratodentata|Dryopteris serratodentata (Bedd.) Hayata|1|0||原生
5222|Dryopteridaceae|鱗毛蕨科|黑鱗遠軸鱗毛蕨|Dryopteris sinofibrillosa|Dryopteris sinofibrillosa Ching|1|0|DD|原生
369|Dryopteridaceae|鱗毛蕨科|落鱗鱗毛蕨|Dryopteris sordidipes|Dryopteris sordidipes Tagawa|1|0||原生
370|Dryopteridaceae|鱗毛蕨科|長葉鱗毛蕨|Dryopteris sparsa|Dryopteris sparsa (D. Don) Kuntze|1|0||原生
371|Dryopteridaceae|鱗毛蕨科|阿里山鱗毛蕨|Dryopteris squamiseta|Dryopteris squamiseta (Hook.) Kuntze|1|0||原生
372|Dryopteridaceae|鱗毛蕨科|細葉鱗毛蕨|Dryopteris subatrata|Dryopteris subatrata Tagawa|1|0||原生
